{
  "absichten": {
    "A": {
      "beleg": null,
      "hebel": "keiner",
      "quellen": [
        "tesla_fleet"
      ],
      "rueckfall": "keiner",
      "schreibfolge": null,
      "sicherheit": "C",
      "wie": "keine kW-Vorgabe."
    },
    "E": {
      "beleg": null,
      "hebel": "geraet",
      "quellen": [
        "tesla_fleet"
      ],
      "rueckfall": "keiner",
      "schreibfolge": null,
      "sicherheit": "A",
      "wie": "operation mode self_consumption."
    },
    "E_decken": {
      "beleg": null,
      "hebel": "offen",
      "quellen": [],
      "rueckfall": "keiner",
      "schreibfolge": null,
      "sicherheit": "D",
      "wie": "unbelegt."
    },
    "E_gedrosselt": {
      "beleg": null,
      "hebel": "keiner",
      "quellen": [
        "tesla_fleet"
      ],
      "rueckfall": "keiner",
      "schreibfolge": null,
      "sicherheit": "C",
      "wie": "keine Leistungsgrenze."
    },
    "E_laden": {
      "beleg": null,
      "hebel": "offen",
      "quellen": [],
      "rueckfall": "keiner",
      "schreibfolge": null,
      "sicherheit": "D",
      "wie": "Reserve = aktueller SoC (Trick, unbelegt)."
    },
    "G": {
      "beleg": null,
      "hebel": "offen",
      "quellen": [
        "tesla_fleet"
      ],
      "rueckfall": "keiner",
      "schreibfolge": null,
      "sicherheit": "C",
      "wie": "Export-Regel (nur PV / alles / nie)."
    },
    "H": {
      "beleg": null,
      "hebel": "offen",
      "quellen": [],
      "rueckfall": "keiner",
      "schreibfolge": null,
      "sicherheit": "D",
      "wie": "Reserve = aktueller SoC."
    },
    "N": {
      "beleg": null,
      "hebel": "offen",
      "quellen": [
        "tesla_fleet"
      ],
      "rueckfall": "keiner",
      "schreibfolge": null,
      "sicherheit": "C",
      "wie": "autonomous + Netzladen erlaubt – keine kW-Vorgabe."
    }
  },
  "adapter": null,
  "bindung": null,
  "daempfung": {
    "box_regelt": false,
    "einschwingzeit_s": null,
    "messtakt_s": null,
    "quellen": [
      "tesla_fleet"
    ],
    "sicherheit": "A",
    "text": "Keine lokale kW-Vorgabe (nur Cloud-Betriebsart): keine Box-Regelung."
  },
  "eigenmodus": {
    "sicherheit": "A",
    "text": "Ja: Betriebsart self_consumption („Self-Powered“) (A)."
  },
  "empfehlung": "Nur Eigenverbrauch + grobe Betriebsart.",
  "fallen": [
    "Cloud-Abhängigkeit, keine lokale Steuerung, keine kW-Werte."
  ],
  "familie": "Powerwall 2 / 3",
  "firmware_bedingung": null,
  "freigabe": "keine",
  "hersteller": "Tesla",
  "id": "tesla",
  "im_repo": "nicht angebunden",
  "modelle": [
    "Powerwall 2",
    "Powerwall 3"
  ],
  "quellen": [
    "tesla_fleet"
  ],
  "schema_version": "1.0",
  "schreibbudget": {
    "dauerspeicher_je_tag": null,
    "sicherheit": null,
    "speicher": "keiner",
    "text": "–"
  },
  "stand": "2026-09-24",
  "stufe": 3,
  "totmann": {
    "sekunden": null,
    "sicherheit": null,
    "text": "–",
    "vorhanden": null,
    "ziel": null
  },
  "uebergabe": {
    "beleg": null,
    "ruecknahme": null,
    "schreibfolge": null,
    "sicherheit": "A",
    "speicher": "cloud",
    "text": "Nur über die Cloud (Fleet API): Betriebsart, Reserve %, Netzladen, Export-Regel (A). Keine kW-Vorgabe."
  },
  "zaehler": {
    "ort": "system",
    "sicherheit": "D",
    "text": "Gateway misst Netz und Haus."
  }
}
