{
  "absichten": {
    "A": {
      "beleg": null,
      "hebel": "sollwert",
      "quellen": [
        "alpha_ha"
      ],
      "rueckfall": "keiner",
      "schreibfolge": null,
      "sicherheit": "C",
      "wie": "Dispatch mit Leistung > 32000."
    },
    "E": {
      "beleg": null,
      "hebel": "geraet",
      "quellen": [
        "alpha_ha"
      ],
      "rueckfall": "keiner",
      "schreibfolge": null,
      "sicherheit": "C",
      "wie": "Dispatch Start = 0."
    },
    "E_decken": {
      "beleg": null,
      "hebel": "offen",
      "quellen": [],
      "rueckfall": "keiner",
      "schreibfolge": null,
      "sicherheit": "D",
      "wie": "unbelegt."
    },
    "E_gedrosselt": {
      "beleg": null,
      "hebel": "offen",
      "quellen": [],
      "rueckfall": "keiner",
      "schreibfolge": null,
      "sicherheit": "D",
      "wie": "unbelegt."
    },
    "E_laden": {
      "beleg": null,
      "hebel": "offen",
      "quellen": [],
      "rueckfall": "keiner",
      "schreibfolge": null,
      "sicherheit": "D",
      "wie": "unbelegt."
    },
    "G": {
      "beleg": null,
      "hebel": "offen",
      "quellen": [],
      "rueckfall": "box",
      "schreibfolge": null,
      "sicherheit": "D",
      "wie": "unbelegt."
    },
    "H": {
      "beleg": null,
      "hebel": "sollwert",
      "quellen": [
        "alpha_ha"
      ],
      "rueckfall": "keiner",
      "schreibfolge": null,
      "sicherheit": "C",
      "wie": "Dispatch mit 32000 (0 W)."
    },
    "N": {
      "beleg": null,
      "hebel": "sollwert",
      "quellen": [
        "alpha_ha"
      ],
      "rueckfall": "keiner",
      "schreibfolge": null,
      "sicherheit": "C",
      "wie": "Dispatch mit Leistung < 32000 und Dauer."
    }
  },
  "adapter": null,
  "bindung": null,
  "daempfung": {
    "box_regelt": true,
    "einschwingzeit_s": null,
    "messtakt_s": null,
    "quellen": [],
    "sicherheit": "D",
    "text": "Unbelegt - Vorgabe der Box, bis am Gerät gemessen."
  },
  "eigenmodus": {
    "sicherheit": "C",
    "text": "Ja: Standard-Eigenverbrauch (C)."
  },
  "empfehlung": "Stufe 3.",
  "fallen": [
    "Offizielle Registerliste nur als Weitergabe-Dokument im Umlauf."
  ],
  "familie": "SMILE-Serie",
  "firmware_bedingung": null,
  "freigabe": "keine",
  "hersteller": "Alpha ESS",
  "id": "alphaess",
  "im_repo": "nicht angebunden",
  "modelle": [
    "SMILE-Serie"
  ],
  "quellen": [
    "alpha_ha"
  ],
  "schema_version": "1.0",
  "schreibbudget": {
    "dauerspeicher_je_tag": 20,
    "sicherheit": "D",
    "speicher": "unbelegt",
    "text": "unbelegt (D)."
  },
  "stand": "2026-09-24",
  "stufe": 3,
  "totmann": {
    "sekunden": null,
    "sicherheit": "C",
    "text": "Dauer läuft ab → Normalbetrieb (C).",
    "vorhanden": true,
    "ziel": null
  },
  "uebergabe": {
    "beleg": null,
    "ruecknahme": null,
    "schreibfolge": null,
    "sicherheit": "C",
    "speicher": "unbelegt",
    "text": "Dispatch-Block 0x0880–0x088A: Start, Wirkleistung (Versatz 32000, < 32000 laden), Modus, SoC (0,4 %/Bit), Dauer (s) (C)."
  },
  "zaehler": {
    "ort": "netzpunkt",
    "sicherheit": "D",
    "text": "Zähler am Netzpunkt."
  }
}
